{
 "schema_version": 1,
 "product": {
  "id": "basic",
  "name": "Basic",
  "family": "core",
  "aliases": [
   "m5stack basic",
   "basic core"
  ]
 },
 "safe_choices": {
  "flash": {
   "use": "4MB",
   "gives_up": "v2.5, v2.6 and v2.7 run an image built for 4MB, but it uses only the first 4MB of their 16MB flash",
   "src": [
    "m5-basic-v2.7",
    "idf-flash-size-check"
   ],
   "confidence": "high",
   "last_verified": "2026-10-03"
  }
 },
 "revisions": {
  "basic@v1.4": {
   "label": "v1.4 (first release, 2017.7)",
   "sku": [
    "K001"
   ],
   "soc": "esp32",
   "platform": "esp32",
   "bid": {
    "value": 1,
    "src": [
     "board-id-csv"
    ],
    "confidence": "high",
    "last_verified": "2026-09-26"
   },
   "support": {
    "status": "supported",
    "reason": "ESP32-family Core controller",
    "src": [
     "m5-basic-v2.7"
    ],
    "last_verified": "2026-10-03"
   },
   "market_status": "delisted",
   "derived_from": null,
   "pin_map": "basic-a",
   "soc_part": {
    "value": "ESP32-D0WDQ6-V3",
    "src": [
     "m5-basic-v2.7"
    ],
    "confidence": "high",
    "last_verified": "2026-10-03"
   },
   "flash": {
    "value": "4MB",
    "src": [
     "m5-basic-v2.7"
    ],
    "confidence": "high",
    "last_verified": "2026-10-03"
   },
   "psram": {
    "part": null,
    "src": [
     "m5-basic-v2.7",
     "board-id-csv"
    ],
    "confidence": "high",
    "last_verified": "2026-10-03",
    "note": "no PSRAM row; board.csv gives None for Basic"
   },
   "display": {
    "part": "ILI9342C",
    "resolution": "320x240",
    "bus": "spi_main",
    "src": [
     "m5-basic-v2.7"
    ],
    "confidence": "high",
    "last_verified": "2026-10-03"
   },
   "touch": {
    "part": null,
    "src": [
     "m5-basic-v2.7"
    ],
    "confidence": "medium",
    "last_verified": "2026-10-03",
    "note": "three physical buttons, no touch panel"
   },
   "imu": {
    "part": null,
    "src": [
     "m5-basic-v2.7"
    ],
    "confidence": "high",
    "last_verified": "2026-10-03",
    "note": "no IMU on Basic"
   },
   "magnetometer": {
    "part": null,
    "src": [
     "m5-basic-v2.7"
    ],
    "confidence": "medium",
    "last_verified": "2026-10-03"
   },
   "pmic": {
    "part": "IP5306",
    "bus": "i2c_internal",
    "address": "0x75",
    "note": "custom I2C version",
    "src": [
     "m5-basic-v2.7"
    ],
    "confidence": "high",
    "last_verified": "2026-10-03"
   },
   "rtc": {
    "part": null,
    "src": [
     "m5-basic-v2.7"
    ],
    "confidence": "medium",
    "last_verified": "2026-10-03",
    "note": "spec table lists no RTC"
   },
   "audio": {
    "speaker": "1W-0928 on G25 (DAC)",
    "mic": null,
    "src": [
     "m5-basic-v2.7"
    ],
    "confidence": "high",
    "last_verified": "2026-10-03"
   },
   "usb_bridge": {
    "part": "CP2104",
    "src": [
     "m5-basic-v2.7"
    ],
    "confidence": "high",
    "last_verified": "2026-10-03"
   },
   "sd": {
    "value": "microSD (SPI)",
    "src": [
     "m5-basic-v2.7"
    ],
    "confidence": "high",
    "last_verified": "2026-10-03"
   },
   "battery": {
    "capacity_mah": [
     150,
     110
    ],
    "note": "150 mAh until 2020.3, then 110 mAh",
    "src": [
     "m5-basic-v2.7"
    ],
    "confidence": "medium",
    "last_verified": "2026-10-03"
   },
   "dimensions": {
    "w": 54.0,
    "h": 54.0,
    "d": 17.0,
    "unit": "mm",
    "weight_g": 49.5,
    "src": [
     "m5-basic"
    ],
    "confidence": "high",
    "last_verified": "2026-10-03"
   },
   "extra_components": [],
   "errata": [
    {
     "id": "tn-panel",
     "text": "Units made before 2019.7 have a TN panel; later ones an IPS panel on the same ILI9342C controller. The old M5Stack library before 0.2.8 shows inverted colours on IPS units.",
     "src": [
      "m5-basic-v2.7"
     ],
     "confidence": "high",
     "last_verified": "2026-10-03"
    },
    {
     "id": "pcb-2018.2a",
     "text": "Units with PCB version 2018.2A do not support USB-C-to-C cables or USB PD power supplies.",
     "src": [
      "m5-basic"
     ],
     "confidence": "high",
     "last_verified": "2026-10-03"
    },
    {
     "id": "ip5306-early-i2c",
     "text": "Gray units before 2017.12 had an IP5306 not wired to I2C. M5 documents this for Gray only; whether the earliest Basic units share it is not documented, so battery readings on a 2017 Basic may return nothing.",
     "src": [
      "m5-gray"
     ],
     "confidence": "low",
     "last_verified": "2026-10-03"
    }
   ]
  },
  "basic@v2.5": {
   "label": "v2.5 (2020.6)",
   "sku": [
    "K001"
   ],
   "soc": "esp32",
   "platform": "esp32",
   "bid": {
    "value": 1,
    "src": [
     "board-id-csv"
    ],
    "confidence": "high",
    "last_verified": "2026-09-26"
   },
   "support": {
    "status": "supported",
    "reason": "ESP32-family Core controller",
    "src": [
     "m5-basic-v2.7"
    ],
    "last_verified": "2026-10-03"
   },
   "market_status": "delisted",
   "derived_from": "basic@v1.4",
   "pin_map": "basic-a",
   "soc_part": {
    "value": "ESP32-D0WDQ6-V3",
    "src": [
     "m5-basic-v2.7"
    ],
    "confidence": "high",
    "last_verified": "2026-10-03"
   },
   "flash": {
    "value": "16MB",
    "src": [
     "m5-basic-v2.7"
    ],
    "confidence": "high",
    "last_verified": "2026-10-03"
   },
   "psram": {
    "part": null,
    "src": [
     "m5-basic-v2.7",
     "board-id-csv"
    ],
    "confidence": "high",
    "last_verified": "2026-10-03",
    "note": "no PSRAM row; board.csv gives None for Basic"
   },
   "display": {
    "part": "ILI9342C",
    "resolution": "320x240",
    "bus": "spi_main",
    "src": [
     "m5-basic-v2.7"
    ],
    "confidence": "high",
    "last_verified": "2026-10-03"
   },
   "touch": {
    "part": null,
    "src": [
     "m5-basic-v2.7"
    ],
    "confidence": "medium",
    "last_verified": "2026-10-03",
    "note": "three physical buttons, no touch panel"
   },
   "imu": {
    "part": null,
    "src": [
     "m5-basic-v2.7"
    ],
    "confidence": "high",
    "last_verified": "2026-10-03",
    "note": "no IMU on Basic"
   },
   "magnetometer": {
    "part": null,
    "src": [
     "m5-basic-v2.7"
    ],
    "confidence": "medium",
    "last_verified": "2026-10-03"
   },
   "pmic": {
    "part": "IP5306",
    "bus": "i2c_internal",
    "address": "0x75",
    "note": "custom I2C version",
    "src": [
     "m5-basic-v2.7"
    ],
    "confidence": "high",
    "last_verified": "2026-10-03"
   },
   "rtc": {
    "part": null,
    "src": [
     "m5-basic-v2.7"
    ],
    "confidence": "medium",
    "last_verified": "2026-10-03",
    "note": "spec table lists no RTC"
   },
   "audio": {
    "speaker": "1W-0928 on G25 (DAC)",
    "mic": null,
    "src": [
     "m5-basic-v2.7"
    ],
    "confidence": "high",
    "last_verified": "2026-10-03"
   },
   "usb_bridge": {
    "part": "CP2104",
    "src": [
     "m5-basic-v2.7"
    ],
    "confidence": "high",
    "last_verified": "2026-10-03"
   },
   "sd": {
    "value": "microSD (SPI)",
    "src": [
     "m5-basic-v2.7"
    ],
    "confidence": "high",
    "last_verified": "2026-10-03"
   },
   "battery": {
    "capacity_mah": 110,
    "src": [
     "m5-basic-v2.7"
    ],
    "confidence": "high",
    "last_verified": "2026-10-03"
   },
   "dimensions": {
    "w": 54.0,
    "h": 54.0,
    "d": 17.0,
    "unit": "mm",
    "weight_g": 49.5,
    "src": [
     "m5-basic"
    ],
    "confidence": "high",
    "last_verified": "2026-10-03"
   },
   "extra_components": [],
   "errata": []
  },
  "basic@v2.6": {
   "label": "v2.6 (2021.10)",
   "sku": [
    "K001"
   ],
   "soc": "esp32",
   "platform": "esp32",
   "bid": {
    "value": 1,
    "src": [
     "board-id-csv"
    ],
    "confidence": "high",
    "last_verified": "2026-09-26"
   },
   "support": {
    "status": "supported",
    "reason": "ESP32-family Core controller",
    "src": [
     "m5-basic-v2.7"
    ],
    "last_verified": "2026-10-03"
   },
   "market_status": "delisted",
   "derived_from": "basic@v2.5",
   "pin_map": "basic-a",
   "soc_part": {
    "value": "ESP32-D0WDQ6-V3",
    "src": [
     "m5-basic-v2.7"
    ],
    "confidence": "high",
    "last_verified": "2026-10-03"
   },
   "flash": {
    "value": "16MB",
    "src": [
     "m5-basic-v2.7"
    ],
    "confidence": "high",
    "last_verified": "2026-10-03"
   },
   "psram": {
    "part": null,
    "src": [
     "m5-basic-v2.7",
     "board-id-csv"
    ],
    "confidence": "high",
    "last_verified": "2026-10-03",
    "note": "no PSRAM row; board.csv gives None for Basic"
   },
   "display": {
    "part": "ILI9342C",
    "resolution": "320x240",
    "bus": "spi_main",
    "src": [
     "m5-basic-v2.7"
    ],
    "confidence": "high",
    "last_verified": "2026-10-03"
   },
   "touch": {
    "part": null,
    "src": [
     "m5-basic-v2.7"
    ],
    "confidence": "medium",
    "last_verified": "2026-10-03",
    "note": "three physical buttons, no touch panel"
   },
   "imu": {
    "part": null,
    "src": [
     "m5-basic-v2.7"
    ],
    "confidence": "high",
    "last_verified": "2026-10-03",
    "note": "no IMU on Basic"
   },
   "magnetometer": {
    "part": null,
    "src": [
     "m5-basic-v2.7"
    ],
    "confidence": "medium",
    "last_verified": "2026-10-03"
   },
   "pmic": {
    "part": "IP5306",
    "bus": "i2c_internal",
    "address": "0x75",
    "note": "custom I2C version",
    "src": [
     "m5-basic-v2.7"
    ],
    "confidence": "high",
    "last_verified": "2026-10-03"
   },
   "rtc": {